{
  "uacp_export": "0.2.0",
  "exported_at": "2026-04-21T17:00:00Z",
  "source": "fusionlayer",
  "conversations": [
    {
      "uacp": "0.2.0",
      "id": "tv_export_1",
      "tool": "chatgpt",
      "title": "Quick question",
      "privacy": "personal",
      "created_at": "2026-04-20T10:00:00Z",
      "updated_at": "2026-04-20T10:01:00Z",
      "messages": [
        { "role": "user", "content": "What time is it?" },
        { "role": "assistant", "content": "I don't have access to real-time data." }
      ],
      "metadata": {}
    },
    {
      "uacp": "0.2.0",
      "id": "tv_export_2",
      "tool": "claude-code",
      "title": "Code review",
      "privacy": "personal",
      "created_at": "2026-04-21T09:00:00Z",
      "updated_at": "2026-04-21T09:30:00Z",
      "messages": [
        { "role": "user", "content": "Review this function." },
        { "role": "assistant", "content": "The function looks good but could use better error handling." }
      ],
      "metadata": {}
    }
  ]
}
